{
	"primary": "#0891b2",
	"primaryHover": "#155e75",
	"primaryFocus": "#164e63",
	"pageBackground": "#ffffff",
	"headerBackground": "#fafaf9",
	"contactBackground": "#f5f5f4",
	"screenBackground": "#f3f4f6",
	"screenBackgroundDark": "#1f2937",
	"text": "#57534e",
	"heading": "#000000",
	"muted": "#78716c"
}
